{
  "schemaVersion": 1,
  "id": "sample-pet",
  "displayName": "Sample Pet",
  "version": "1.0.0",
  "description": "Manifest-only example for Codex V2 pet authors.",
  "author": "Example Author",
  "sharedBy": "example-author",
  "createdAt": "2026-07-20T00:00:00Z",
  "license": "CC-BY-4.0",
  "spriteVersionNumber": 2,
  "spritesheetPath": "spritesheet.webp",
  "atlas": {
    "columns": 8,
    "rows": 11,
    "cellWidth": 192,
    "cellHeight": 208
  }
}
